source,public_time,content,topic,url
燕赵晚报,2020-12-17,免费观看优秀学生代表发言稿:谷歌在印度面临新反垄断案件:因滥用智能电视市场领导地位2020-12-17 01:46:42 免费观看优秀学生代表发言稿 ...,免费观看优秀学生代表发言稿_免费观看优秀学生代表发言稿,http://yzwb.sjzdaily.com.cn/appSDfa?gs.htm
手机凤凰网,,"宣布中国市场渠道变革不足一周,好时大中华区总经理突然离职。12月1日,北京商报记者从好时公司相关负责人处获悉,好时现任大中华区总经理胡庭洲正式离职,中国团队将由...","大中华区总经理突然离职,好时拿什么拯救它的“糖果帝国”?",https://finance.ifeng.com/c/81qw5wSdFA0
百家号,,"add_header Content-Security-Policy ""script-src 'nonce-EDNnf03nceIOfn39fn3e9h3sdfa' 'self';""; } 举报/反馈 作者最新文章 5个内容解决HTTP面试的难点(建...","CSP和Nonce并不难,5分钟简单易懂",https://baijiahao.baidu.com/s?id=1673242196332871712&wfr=spider&for=pc
腾讯网,,"“老师您好,过段时间家里打算购买一台330TSI豪华版的大众迈腾,我对这款车型实在是太喜欢了,不仅外观沉稳大气,而且空间的表现也很好,所以我想了解下这款车现在优惠...","我想买一辆大众迈腾330TSI豪华版,现在优惠多少,全款多少钱?",https://new.qq.com/omn/20200429/20200429A0SDFA00.html
百家号,,"邮箱:请同时发送邮件至project_sdfa@citics.com 中信证券后续将持续跟踪上述重大资产重组对发行人生产经营情况的影响,并将严格按照《债券受托管理协议》及《债券持有人...",山东省金融资产管理股份有限公司公司债券受托管理人临时报告,https://baijiahao.baidu.com/s?id=1654124983779468558&wfr=spider&for=pc
MBA中国网,,"主题发言环节,可持续数字金融联盟董事Marianne Haahr介绍了SDFA所做的工作。北京环境交易所副总裁龚俊松作“中国碳普惠的实践与思考”主题发言,介绍了中国碳普惠在过去...",国内首场可持续数字金融研讨会在中央财经大学举行,https://www.mbachina.com/html/mpaccfs/201701/206651.html
懂球帝官方,,"(工商或民政注册件);赛事组委会统一印制的报名表(纸质版加盖协会公章后的电子版扫描件,电子版报名表及俱乐部队标识、集体照片发sdfa_shfzb@126.com),逾期不予...",2019齐鲁业余足球超级联赛报名开启,https://www.dongqiudi.com/news/1251745.html
百家号,,"区块链对气候变化具有重要意义,可持续数字金融联盟(SDFA)与汇丰可持续金融中心联合发布了这份报告:“可持续发展相关债券的区块链门户:逐条拓宽融资渠道”。该报告概述...",联合国大会传递出全球危机的区块链解决方案信号,https://baijiahao.baidu.com/s?id=1645827124935949622&wfr=spider&for=pc
百家号,,"有本事突然从我背后出现,把我的脸按在键盘上sdfahasdhnoiajhnoirgv…… 其实在原著里八云紫对自己的年龄根本就不在乎,奈何二设的影响力太深,所以大部分人自知道...",动漫里的合法萝莉?最后一个不承认她是萝莉你就等着吃键盘吧,https://baijiahao.baidu.com/s?id=1636554565744589951&wfr=spider&for=pc
中证网,,投资者可登录中国证监会山东监管局网站(www.csrc.gov.cn/pub/shandong/)、山东省证券业协会网站(www.ssfa.org.cn)及山东省期货业协会网站(www.sdfa.com.cn)...,山东证监局:理性投资 远离非法证券期货活动,http://www.cs.com.cn/sylm/jsbd/201603/t20160324_4932186.html
