source,public_time,content,topic,url
百家号,2021-01-04,#杨幂完美女孩剧照##听见她说#收官之作《完美女孩》杨幂剧照好绝，眼神都是戏，《完美女孩》以未来感的机器人为题材，”我是完美的，肤色、身高、三围”，“如果身体总能修复，意味着伤害不存在吗？”期待杨幂饰演的AI小爱，让我们我们一起反思当代女性被物化的现实议题。明天中午12点见。明天和小爱见面，中午12点不见不散，期待杨幂完美女孩明天中午明天中午一起看一起看，明天见，我的完美女孩。期待杨幂完美女孩，完美女孩，杨幂明天见；大幂幂真的好漂亮啊！很期待啊，明天不见不散；这个造型真的很绝啊，也太好看了。明天不见不散哦，我幂姐身材也太好了，杨幂就是完美女孩，肤色，身高，三围；非常完美的人生，看完觉得真不错。眼神特别棒啊，这个片子非常适合她，这个剧照真的非常不错啊，大幂幂的新片一定要支持。真的是很期待的啊，大幂幂好绝，剧照好美，明天中午12点不见不散，期待杨幂！诶呀期待的了，明天就要和幂幂见面了，好期待哦，杨幂这次演的是机器人吗，这个题材的剧我很期待呢。大幂幂好美呀，实力圈粉了，一直都喜欢幂幂呀，人美演技好，期待期待！这次的扮相真的很好看，杨幂姐姐从来没有让我失望过！那我就先等着了，很期待呢，这样的物化电影真的值得深思呀。,"杨幂完美女孩剧照好绝,眼神都是戏,不过物化现实真的值得深思",https://baijiahao.baidu.com/s?id=1687940497138580528&wfr=spider&for=pc
百家号,2021-01-04,不得不说，在当下社会中，资本才是让人低头的关键，就比如娱乐圈，即使明星很大咖位，但只要钱到位，明星都能任劳任怨。当然了，当初星光大赏就是一个很典型的例子，王一博、赵丽颖、杨幂、吴亦凡、杨紫、肖战、迪丽热巴以及杨洋，这八个人可是当红顶级流量，而鹅厂财大气粗，愣是将这八个明星都聚在一块，足以看出，鹅厂是真的很在意排面！01鹅厂娱乐盛典又下重本？可除了星光大赏之外，鹅厂对待一些小活动也很重视。这不，新一次鹅厂娱乐年度盛典也正式官宣了明星阵容，但一看这名单我要诧异了，此次明星阵容又将会是一场视觉盛宴！老实说，鹅厂这是又下重本了？薇娅、徐峥、闫妮、郭颖、张译、张云雷、周深等人都齐齐加盟，看来这一次鹅厂娱乐年度盛典要让各家粉丝乐开花了！其中，杨笠加盟鹅厂娱乐年度盛典，这一点我是真的没有想到，毕竟杨笠在近期引发了不少男女双方的辩论，可以说，杨笠是一个很有争议性的话题人物。只不过鹅厂力邀杨笠加盟这一次盛典，恐怕咱们又能听到很多有意思的相声论题了！硬糖少女小分队也加盟鹅厂娱乐年度盛典，只不过看看名单，除了希林娜依・高、张艺凡之外，其他小姐姐都确认加盟了娱乐盛典呢，你们期待吗？老实说，硬糖少女不愧是鹅厂力捧的“宠儿”，自从出道之后，鹅厂的相关活动都会邀请硬糖少女表演，看来这个女团很吃香呀！02张云雷丁禹兮助阵！张云雷也确认加盟了娱乐年度盛典，相信很多德云社粉丝要激动跳脚啦！张云雷这个人很有意思，虽说他是说相声，但张云雷却有一张超级帅气的脸蛋，因此他走红后圈了不少颜值控粉丝，如今张云雷助阵鹅厂娱乐年度盛典的话，的观众肯定是能大饱眼福了！值得一提的是，丁禹兮也助阵鹅厂娱乐年度盛典，看来观众不容快进一秒晚会视频了。丁禹兮在《传闻中的陈芊芊》电视剧之后，他就凭借接地气和耿直的个性圈粉无数，但我想说，丁禹兮颜值跟张云雷不相上下，他助阵晚会，光是想想他西装革履的模样就觉得很过瘾啦！03杨幂李易峰助阵！另外，鹅厂邀请了杨幂出席盛典，不得不说，鹅厂是真的下血本了。杨幂作为娱乐圈中长红十几年的女明星，身价和咖位是真的很高，但只要鹅厂有活动，杨幂肯定是嘉宾，足以看出，杨幂到底多么受到鹅厂的重视啦。只不过很有意思的是，杨幂出席鹅厂娱乐年度盛典，李易峰这一次也加盟盛典呢。老实说，李易峰跟杨幂算是老朋友了，然而因为网上的非议，李易峰跟杨幂已经渐行渐远了，并且在公开场合之下，杨幂李易峰都不会有交集和互动。而如今鹅厂娱乐年度盛典同时邀请了杨幂跟李易峰，不知道两人会不会“破冰”？要知道，俊男美女同框的画面是真的很赏心悦目呀！04全名单豪华，又是一场视觉盛宴！另外，华晨宇也助阵了鹅厂娱乐年度盛典，这回盛典可不止是视觉盛典了，反而更是耳机党的福音啦。要知道，华晨宇唱功能力很强，而且现场全开麦更是稳得不行，如果他这次舞台表演，我定然期待连连！当然了，鹅厂既然是要弄一个豪华且隆重的年度盛典，当红话题人物金晨自然不会被忽视的啦。金晨《隐秘而伟大》电视剧播出之后，金晨就陆续上热搜，虽说词条有好有坏，但金晨实实在在受到了关注，如今金晨助阵鹅厂娱乐年度盛典，恐怕会在一定程度上提升盛典的人气。但不管怎么样，此次鹅厂娱乐年度盛典明星名单这么豪华，一大批高颜值明星助阵，这盛典又怎么不会是一场视觉盛宴呢？你们期待这一次盛典吗？,"鹅厂娱乐盛典又下重本?杨幂李易峰助阵,全明星又是一场盛宴",https://baijiahao.baidu.com/s?id=1687939937413727189&wfr=spider&for=pc
百家号,2021-01-04,不避嫌！杜淳搂baby脖子亲密互动，手放的位置暴露人品，晓明哥不吃醋？2021年的第一天，杜淳在社交平台上官宣自己结婚的喜讯：“在已经到来的2021，祝愿大家的生活都平安喜乐，幸福美满，我们也是。”瞬间刷爆全网，毕竟大家根本没有听到杜淳感情上的任何消息，就突然官宣结婚了，还是有些让人惊讶的，但既然人家官宣喜讯了，我们也就只能祝福了！自从杜淳官宣结婚的喜讯后，网友们就对杜淳的妻子很好奇，因为至今外界没有任何关于杜淳妻子的消息，有传言称杜淳妻子是圈外人，但并未得到证实，所以大家还是不要随意猜测了！一直以来，在大家印象中，杜淳都是个“情场高手”，身边美女如云，就连杨幂都直言：“娱乐圈中就没有杜淳不认识的女生”，就连已经官宣结婚后，杜淳似乎依旧不懂得如何避嫌，也可以说他是不愿想那么多！1月4日，Angelababy和杜淳一起出席发布会，在现场两位亲密互动的举动引起了网友们的热议，先不说baby是已婚人士，杜淳还是新婚燕尔，两人的举动被质疑不避嫌！视频中，杜淳穿着西服外套，搭配牛仔裤，休闲不失时尚感，一旁的baby穿着黑色的连衣裙，腰间加上蝴蝶结做装饰，头发全部放在一旁，整个人显得优雅又大气，据悉两人是因为合作才一同出席活动，但在现场杜淳双手搂住baby的脖子，两人几乎是紧紧的贴在一起，杜淳手放的位置更是暴露人品，杜淳的手直接放到了baby的胸前，两人互动十分亲密，可baby的表情却很自然，网友直言：晓明哥不吃醋吗？看到杜淳结婚后还不懂得避嫌，有些不妥，网友还提起前几天，杜淳被排到和几位美女一起出去聚餐，其中一位年轻女生紧紧跟在杜淳身后，虽然没有露出正脸，但看上去却眉清目秀，鼻梁也很高，颜值应该不会低，网友猜测可能这位就是杜淳的“妻子”吧？看到杜淳身边总是不缺美女，网友们表示才刚官宣结婚不久，和异性如此亲密互动，完全不像是已婚男士，让人很没有安全感！还有网友吐槽杜淳的手放的位置也太“绝”了！不过也有网友为杜淳说话，虽然的确有些不避嫌的行为，但其实也没有太过分的举动，和baby亲密互动也只是为了宣传新戏，外出聚餐也没有单独约辣妹，而且身边还有于正等人，应该是人际交往，所以相信杜淳的妻子一定会理解的！但话说回来，作为娱乐圈中的公众人物，baby不仅仅是已婚人士，更是小海绵的妈妈，在外面出席活动更应该懂得和异性避嫌，省得闹出绯闻就不好了，更何况女生吃醋可不如男生吃醋厉害，如果晓明哥真的在意很容易影响夫妻感情的！无论是杜淳还是baby，作为公众人物，又是已婚人士，都应该懂得避嫌，避免出现绯闻，把注意力放在影视作品上更好，希望两人可以注意自己的言行举止吧！如果你的另一半和异性这样亲密互动，你会吃醋吗？,"不避嫌!杜淳出席活动搂baby脖子亲密互动,手放的位置暴露人品",https://baijiahao.baidu.com/s?id=1687939748326431736&wfr=spider&for=pc
百家号,2021-01-04,导语：对于女人来说拥有一双美腿是很幸运的事情，如果能够拥有一双又细又长的双腿，那么不管穿什么样的衣服都会非常好看，尤其是在夏天的时候，像一双大长腿露出来，也会显得特别有魅力，能够吸引到更多人的关注，很多女生都为了能够拥有完美的身材去盲目的减肥。说起来娱乐圈的腿精，那可真的是太多了，今天小编要给大家介绍的这个美女，相信很多人再熟悉不过了，问火遍大街小巷，说出她的名字，相信很多人都能够说出她的很多部剧，这个人就是人人都喜欢的杨幂。杨幂的身材在人的圈里也是很优秀的，数一数二，她每次在机场被街拍所穿的衣服在网上很快就能售罄，在她身上该瘦的地方瘦，有肉的地方有肉，尤其是那一双大长腿，让很多人都羡慕，虽然在脸上也看出了被岁月侵蚀过的痕迹，但是身材完全没有被侵蚀过。杨幂之所以30多岁还能够拥有少女般的身材，就是因为她很喜欢健身，因为健身让她身材比例变得很完美，当时在生完孩子以后也没有放松警惕，让自己努力投入到健身的队伍中。身材好了才能受到更多人的喜欢，现在的她不管穿什么衣服都显得很合身，每次在机场都像一个行走的衣服架子，还被称为带货女王。一双修长的美腿对于女人来说真的是很重要的，它能够让人看起来更加的轻盈，如果是一双大粗腿，而且又没有型的话，那么自然不会漂亮，一双腿是能够压身高的，如果你腿又长又细的话，就会给人一种很有气质高贵的感觉。杨幂从出道到现在身材几乎没有怎么变过，一直以来都是这么好，除了多运动，首先在饮食方面也很控制。之前，在一个节目上更是做出了一个惊人的举动，像我们在吃米线的时候都是大口大口地吃，但杨幂在那个节目中没想到她竟然只吃了一根米线。从这样的一点就能看出来，她非常自律。但是她没有过度的节食，只是不会去吃那些容易发胖的时候，盲目减肥是不好的，她最喜欢的是通过运动来让自己变瘦，每天都会让自己运动半个小时多出汗才会瘦得更快，但事业中也很拼搏，一直以来给大家带来了很多优秀的作品，演技得到了很多人的认可。结语：健身真的还是要靠自律，除了要管住嘴，最重要的就是迈开腿，在健身这方面没有别人能够代替你，千万不要松懈，只有坚持才能成就出最完美的自己，如果你们也想拥有像杨幂这样完美身材的话，那就赶紧加入到健身的队伍中去吧。,"35岁杨幂秀身材,高颜值加大长腿惹人爱,坦言是健身改变了她",https://baijiahao.baidu.com/s?id=1687939660520864158&wfr=spider&for=pc
百家号,2021-01-04,杨幂作为时尚带货女王，她的服装造型自然是不用多说，每一次的出境都是超乎想象的好，而且在她身上出现过的单品，往往都是爆款产品，可以见得杨幂的带货能力有多强。最近，杨幂的节目造型和私服造型也是给人眼前一亮，不同的两套搭配展现出不一样的美感，不知道你们有没有关注到杨幂最近的造型呢，一起来看看吧。节目造型杨幂身穿一件红色针织开衫十分的时髦，红色的针织开衫加入了民族风的设计，显得慵懒又随心，杨幂的内搭选择的是一件白色的上衣打底，下半身搭配一条黑色裤子，整个宽松的造型在镜头下显得十分吸人眼球，尽显舒适风格。镜头下的杨幂，一头蓬松的发型看上去精致又随性，镜头下的杨幂戴着精致的镶钻项圈耳环，显得时尚力十足，当天的杨幂还化着一个淡雅的元气妆容，皮肤状态也是超级的好，整个人展现出非常活力的一面。坐在沙发上的杨幂，下半身搭配的是一条水洗牛仔裤，看上去也是超级的舒适休闲，脚上则是一双白色的袜子，简约又舒适，镜头下的杨幂，还做了精致的红色美甲，不愧是爱美的超级美少女，整个造型简约又不失大气。微微一笑的杨幂真的是超级撩人，蓬松的发型加上宽松的针织开衫，给人一种舒适又日常的感觉，而且红色与白色拼色的针织衫，显得整个造型更加的吸人眼球，不得不说，杨幂的这次的节目造型真的很赞。私服造型杨幂身穿一件白色的毛绒外套显得干净又纯洁，非常的有格调，而且外套也采用了黑色镶边的设计，显得清爽又暖和，绝对是冬天的必备神器之一，镜头下的杨幂内搭一件黑白拼色的针织开衫，尽显时尚魅力。杨幂的最里边还搭配了一件竖条纹衬衣，微微解开的扣子让人看上去尽显小性感，叠穿的效果也是非常流行的，杨幂的这一身打扮，时尚又不失魅力，整个人散发着魅力，而且还戴着金色的耳环，更加的吸人眼球。杨幂的下半身搭配的是一条黑色皮质裤子，看上去十分的精致舒适，手上提着一只黑色的小包包，经典又时髦，一身白色与黑色碰撞的造型，衬托得杨幂更加有时尚力，脚上一双白色的板鞋，尽显休闲风格。一头黑色蓬松发型的杨幂，戴着一顶黑色的棒球帽，非常的舒适简约，尽管她戴着口罩，但是也可以感受到她的气场，镜头下的杨幂状态超级好，一身轻松又舒适的装扮，真的是太适合冬天了，保暖又时尚，不知道你感觉如何呢？杨幂的这两套造型都是日常百搭休闲款，节目中的红色针织开衫时尚又慵懒，而私服造型中的白色毛绒外套简约又精致，都是不错的时尚单品，不知道你更加喜欢她哪一套造型呢？（声明：文字原创，图片源自网络，如侵权请联系删除。）,"杨幂最近两套造型曝光,节目造型与私服造型,你pick哪一套",https://baijiahao.baidu.com/s?id=1687939232571098686&wfr=spider&for=pc
百家号,2021-01-04,腾讯娱乐年度盛典官方宣布啦，这也算作２０２１年的第一场星光盛典吧，在这里一场星光盛典上邀约的大牌明星特邀嘉宾很奢华的。大伙儿看过一定会很希望。有徐峥，徐峥这几年给观众带来了许多精彩纷呈的著作，也报名参加了一些娱乐节目备受观众的喜爱。徐峥的来临不清楚是否会带来许多的话题呢。也有张译的来临，张译是一位整体实力知名演员，出演了许多的影视作品著作。张译的整体实力得到了观众的认同和喜爱，许多的观众是很喜欢看张译出演的著作。此次报名参加腾讯娱乐年度盛典，坚信在主题活动上的造型设计一定会很酷帅和填满风采。闫妮这几年带来了许多精彩纷呈的著作，好像《少年派》，《我待生活如初恋》等，闫妮的整体实力强，不管营造哪些设计风格的人物角色都很精彩纷呈。长相和身型维护保养得也都很好。也有郁可唯亲姐姐的加盟代理，郁可唯是一位歌星，带来许多欢快的音乐。以前还报名参加了唱歌选秀节目再度被观众关心，资源层面也越变越好了。希望郁可唯在腾讯娱乐年度盛典会给大伙儿带来十分多的话题。糖果美少女也加盟代理了腾讯官方的年度盛典，但是在宣传海报上我们可以见到宣传海报上仅有五个人的参加，张艺凡和希林娜依高可能是由于行程安排的缘故不可以一起参加吧，尽管仅有五位漂亮小姐姐的来临，粉丝还是很希望的。腾讯娱乐年度盛典还邀约来到杨幂，杨幂在演艺圈的人气值很高的，能够说成星光盛典上的熟客了，大部分每一场举办活动上都是会见到杨幂亲姐姐的影子，并且在主题活动上的造型设计也是令人眼前一亮，来看此次杨幂在星光盛典上的造型设计依然会带来非常大的意外惊喜吧，迫不及待要想到那一天的来临了，禁不住要想看星光盛典上女星的造型设计。见到周深张云雷追了张云雷的报名参加确实爱了爱了，作为德云女孩儿坚信大伙儿一定会对着张云雷去看看星光盛典直播间的，张云雷在演出舞台上带来许多精彩纷呈的相声小品，在歌唱上也是很超好听的。张云雷报名参加腾讯娱乐年度盛典，粉丝很是心动，期待在星光盛典上面给大伙儿带来许多的话题。不得不承认特邀嘉宾主力阵容确实好奢华，这下不要看真的是可惜了。刘浩存亲妹妹，观众不是生疏的吧，是新一代“星女郎”，由于在影片《送你一朵小红花》被观众关心和喜爱，尽管是年轻演员，但是在整体实力上是有目共睹的，还由于灵性的相貌被大伙儿喜爱。刘浩存的第一部影视作品就得到了非常好的用户评价，坚信在娱乐圈的发展趋势一定会越变越好的。期待在腾讯娱乐年度盛典上面见到一个好看讨人喜欢的刘浩存亲妹妹。终究在星光盛典上，大牌明星们一个个全是盛装出席的，而大伙儿最关心的应当便是女星在星光盛典上造型设计。最终也有周深的加盟代理，周深这几年在演艺圈的发展趋势很好，也算作很火热的一位实力派歌手了，好像在跨年晚会上，周深就报名参加了四个。由此可见在整体实力和资源是非常好的。并且在一些星光盛典上也会见到周深的影子。这一次报名参加腾讯娱乐年度盛典，粉丝很是兴奋了，不清楚在这个星光盛典上是否会再次给大伙儿带来许多精彩纷呈的话题呢？仅是见到剧图上的造型设计就注意力不集中了，腾讯娱乐年度盛典的开播在１月１7号，间距开播的时间愈来愈近了，朋友们这下又有眼福了呢。,"腾讯娱乐盛典第二波阵容,硬糖少女杨幂加盟,看到周深张云雷追了",https://baijiahao.baidu.com/s?id=1687937353848225289&wfr=spider&for=pc
腾讯新闻,2021-01-04,每周一更新的《追光吧！哥哥》加料版都会奉上不少幕后内容，都是正片没有播出的片段，最新一期应该是特别嘉宾杨幂最后一次露面，看似平常的探班拍摄细看其实相当精彩，必须要说杨幂、郑爽、金星这三人为这个节目“付出”了太多。节目组给准备了一些水果甜点让杨幂和郑爽带给选手们，顺道聊聊天社交一下拍点镜头凑时长，这种策划实在有点水，气氛也很容易尴尬。果真杨幂刚到第一组的时候，明道、于朦胧和肖顺尧都有些反应不过来，打了个招呼就不知道怎么继续了，看到杨幂和于朦胧拥抱明道更是直接躲开，眼见着就要冷场。还好明道作为前辈比较有经验，开始调侃于朦胧和杨幂，抱怨杨幂只给于朦胧拥抱加油，明明自己也是零基础。杨幂接话也是很快，先是解释自己和于朦胧合作过比较熟悉，之后就开始吹捧起剩下二人，直说：“我看过你们训练室那个（舞台），惊不惊喜意不意外！你们跳得已经够好了”，这话说得挺漂亮，其实她并不是这一组的组长，主要就是为了看一眼于朦胧，倒是把明道和肖顺尧夸了一通。等到这组真正的组长郑爽进来的时候，明道还顺势继续调侃，开口问：“是给朦胧吗”，肖顺尧还推了于朦胧一把，让他站出来。结果郑爽只当没听见，也不接茬，上来就问：“是不是压力还挺大的？”明道被忽视了扶了扶话筒也不好再说，被推出来的于朦胧回了一句：“就我跳得太差了”。接着郑爽就开始给于朦胧找理由，说他是太害羞了学学明道的自信就好了，离开前还对着于朦胧说：“有错的话没关系，你是主角！”《追光吧》于朦胧一直被指是“皇族”，一路确实比较受捧，人气和关注度都比较高，镜头和脚本对他都很偏爱，可他平时训练缺席舞台又划水，也惹来不少网友逆反，和他一起录制节目的选手对此状况是什么想法也很难摸清，这时候杨幂和郑爽分开来探班，一个帮忙示弱一个盲目鼓励，哪一个外人听起来更顺耳不用多说了吧。接下来几组探班，杨幂和郑爽都是分开的，但气氛真的完全不一样，不得不说尽管杨幂总是被吐槽杠精，但她的社交能力实在很不一般，之前节目里杨幂最关注陈志朋，而郑爽最关注符龙飞，探班时遇到喜欢的选手时，郑爽的表现是：“别人选不选我没关系，符龙飞选我就行”，一把踩了其他所有选她的人。杨幂面对陈志朋的时候，开口就是感慨他好厉害觉得他超帅，因为陈志朋很骄傲自己减重成功，杨幂就追着他聊这一点。当然她也没忘了夸陈志朋的队友们，不但要说陈志朋厉害还要一起夸整个组，最后四人还聊了起来，最后陈志朋特别强调：“我们是杨幂队！”杨幂这一路已经打了不少包票，跟刘维陈晓东提到自己有手卡，承诺会好好介绍他们，跟陈志朋聊天的时候也透露自己有（复活）特权，让他们放心都交给她。换到另一边看，卡斯柏问了一个类似的问题，对着郑爽开口：“我们是一个队，对吧”，郑爽的回答是：“你们的胜负跟我没有什么关系”。郑爽在后台采访的时候提到自己也帮不上太大的忙，也就是缓冲一点紧张感，这大概是她把“我不在乎你们随意”挂在嘴边的原因吧。只是几乎每一组郑爽都要再来上一句：“你们这个挺高难度的”，也难怪网友说她实在不会沟通。这段时间不少明星都喜欢玩真性情和人间清醒的梗，怼人、毒舌、讽刺和辩论金句也经常上热搜，可这些真的更多是镜头前的表演，等到落实到真实互动社交，嘴甜笑呵呵更受欢迎，噎人冷场并不是什么值得骄傲的事，大家千万不要被一时人设迷惑哦。本文未经授权严禁转载违者必究！,"《追光吧》杨幂社交能力不一般,和郑爽分开探班,气氛完全不一样",https://new.qq.com/omn/20210104/20210104A0AP8Y00.html
