source,public_time,content,topic,url
腾讯新闻,2021-01-04,最近《奇葩说》第七季开播了，我一直很喜欢这个节目。节目开播后也因为金句频出，引发一波又一波的热搜。而其中最大的亮点，是话题女王——杨幂。杨幂一直以来都是争议人物，但今天我们不论是非，办公室的七柒看完后，说她从杨幂的身上看到非常多普通人值得学习的点，因此，我请她来分享一下。01▼内心强大，才能让一切经历为我所用《奇葩说》最新一期有个辩题，马东问杨幂：“会把前任当人脉吗？”。杨幂离婚是公众都知道的敏感话题，一般人被问到这种问题，可能手足无措、尴尬不已，更别提明星了。没想到杨幂直接了当：“我觉得我才是那个人脉”。没有任何迟疑，机智的回答+干练的态度，令现场选手顿时拍手叫绝，同时圈了大波网友好感。不得不说，与马东、蔡康永、薛兆丰三大“老狐狸”同台，杨幂的表现依然抓人眼球，评价选手也是犀利得当，表现可圈可点。其中最犀利的一个场景，莫过于有人当面吐槽外形：“可能你要听点实话这样子，我觉得你本人跟照片还是有差”。这不是当着面戳穿她是“照骗”吗？这个问题还蛮毒舌的。而杨幂却淡定回应：“没关系，我的受众群也不是你们。”一句“没关系”接纳了对方的挑衅，而一句“我的受众群也不是你们”又表明了立场。可以说，在这种尖锐的氛围下，这个回答是既有态度又不失体面了。杨幂因为出道较早，一路被造谣、诋毁的事情太多了，面对网暴，她说：“你应该感谢每一个骂你的人，它都是你草船借来的箭，你就等着东风一吹的时候，再说吧。”能够把一切好的坏的经历全盘皆收，并让其“为我所用”，杨幂的内心可谓不是一般的强大。“幂式金句”频上热搜不无道理，句句戳中人心。就连洞察人性极强的蔡康永，都毫不吝啬地夸杨幂：“她是一个特别爽快的人，坦率，能用锐利的眼光识破别人的表演和煽情。”这些年她虽然遭受无数非议，但不仅没有倒下，反而愈来愈强。感情上，拿得起放得下，能在最红巅峰时义无反顾宣布结婚生女，又能在感情破裂后果断离婚。名气上，凭借《宫锁心玉》、《三生三世十里桃花》等多部现象级作品，成为商业价值Top位置女明星。她还实现了从演员跨行当老板，捧出迪丽热巴等当红小花，成功跻身资本圈。杨幂被网友们称之为“拼命三娘”，一路走来步步为营，她自己说：清醒的人，都是在努力地活着的人。泰戈尔说：“那些杀不死我的，终将使我更强大。”这句话用来形容杨幂绝对不为过。02▼以终为始，清醒规划自己的人生杨幂给我的第二个启发，是她的目标感。杨幂的事业并非一直顺风顺水，在演艺道路上有两件事让她耿耿于怀。第一件是刚出道时拍的一场哭戏，当时她年纪小，反复拍了好几遍都没有过。导演就直接走过去，站在她面前，毫不客气地照着她的脸扇了一巴掌。第二件事是她争取到一个期待已久的角色，努力培训了很久，之后也跟剧组签下合同。没想到临开机前一天，对方直接打电话告诉她：“对不起，我们已经把你换掉了。”后来才知道原因，是投资人女友看中了她要饰演的那个角色。没有地位，没有资本，没出名的她尝尽人间冷暖。从那一刻起，她清醒认识到，不能只当一个籍籍无名的小演员，浑浑噩噩拍一天过一天，她必须要红。杨幂是个目标导向很强的人。从此只要有机会，她都不会轻易放过。大角色小角色，365天待在剧组，不断增加曝光度，逐渐小有名气。终于2011年她等到《宫锁心玉》，一夜爆红。从跑龙套，到拼命拍戏赚钱，到不断维持和扩大自己的名气，到和经纪人自立门户，再到签约并培养艺人……杨幂每一步都目标明确，成功实现了从籍籍无名的演员到现在的老板的身份跨越。很多人的人生为什么会迷茫？最核心的原因就是因为缺乏目标。没有目标的人生，就像是开车没有方向盘，风筝没有线，虽然在动，却不知道该往哪里走，这样导致的结果就是碌碌无为。薇安姐常说，做事情要“以终为始”，在做任何事时，先想清楚自己想达到什么目的，再根据目的拆解出相应的关键因素，并且做出行动。例如如果你要买房，你得先清楚自己要买什么样的房子（目标），要达到这个目标，需要找到最合适的中介、房源（关键因素），再去看房、判断、最终买房（行动）。当你拥有了目标，你的所有行动都会为这个结果而努力，你的努力也就有了意义。03▼戒掉情绪，才拥有最顶级的魅力杨幂身上有个大家公认的标签——高情商，其背后隐射的就是——强大的情绪管理能力。她有一句火出圈的名言：“我把情绪戒掉了”。在面对各种恶意抹黑时，她不仅没有崩溃和自我怀疑，反而一笑置之地用自黑反击：被人攻击鼻孔大，自己发鼻孔插座的图；被人断章取义说脚臭，在结婚当天自嘲说已经穿好婚鞋；被嫌发际线高，在发布会里请大家珍惜现在有头发的她……有一次，杨幂的好友张大大抱怨工作辛苦，她说：“你往下去看一看，每个人都很辛苦。所以你凭什么要别人了解你的辛苦？”一句话，就体现了杨幂在面对负面情绪时的态度——是啊，谁不辛苦呢？可是抱怨又有什么用？发泄情绪解决不了任何问题，如果任由情绪泛滥，人最消耗的其实是自己本身，又称内耗。真正厉害的人，都懂得管好自己的情绪。把能量聚焦在解决问题上，情绪的难题最终都会迎刃而解。如果你和别人吵了架，如果你一昧地生气、愤怒，觉得自己委屈，最终更受伤的一定是自己。而如果你能去思考：我和他出现了什么矛盾，怎么样解决更好？我们有什么共同目标没有？下一步我该怎么做？你会发现，你不但不会陷入情绪内卷化，还因此可能成功化解难题。人生在世总会遇到各种各样的挫折和挑战，能够管理情绪并进行自我激励，才是高情商的表现。心理学上说：人的情绪和行为结果主要根源于自己的信念。而当一个人被不合理信念控制的时候，就会产生情绪困扰，进而引发不好的后果。我们都知道，如果无法控制情绪的话，伤人伤己。情绪没有好坏之分，一切都源于你心中所想，只要能将它为自己正向所用，不管在工作生活还是情感关系中，都会让你收获良多。04▼活出自我，让人生拥有无限可能今年是“女性”话题最多的一年，前有《乘风破浪的姐姐》引领更多女性认清自己，勇敢拼事业，后有赵薇执导国内首部女性独白剧《听见她说》，大谈容貌焦虑、物化女性……这个过程，让女性们开始去关注和剖析自己内在的真正需求。我们也发现了女性的魅力越来越多元化，不再是别人给的标签代号，某某太太、某某妈妈；不再是依附别人的附属品.....“人间清醒”的杨幂，她显然活出了独立自信的大女主状态。其实每个女性，通过不断成长，都有机会活出内心强大的自己。日野原重明说，只要迈出第一步，风景就会不一样。是的，人生不设限，一切皆有可能。希望每位女性经历人生不同阶段、不同角色后，依然能活得轻松通透，游刃有余。本文图片来源于综艺《奇葩说》，如有侵权，请联系删除。今日话题你觉得杨幂身上哪一点最值得学习，为什么？本文首发于公众号：薇安说。号主薇安，前世界500强高管，每年掌管生意数10亿。畅销书《迭代》作者，当当网最具影响力作家。演讲成交教练，资深教育专家，全网粉丝学员近百万。文章仅代表作者观点，不代表“《人力资源》杂志”立场。分享、在看与点赞只要你点，我们就是胖友,杨幂上《奇葩说》放大招:我才是前任的人脉!,https://new.qq.com/omn/20210104/20210104A01IJ700.html
腾讯新闻,2021-01-04,最近有2个热门综艺在播，一个是《我就是演员3》，该节目因评委犀利点评、嘉宾表现太水而频繁上热搜。另外一个综艺是《追光吧哥哥》，这也是一档经常上热搜的竞技真人秀，金星是节目的教导主任，郑爽和杨幂2位顶流花旦做为人气助力官加盟，还有杜淳、檀健次、于朦胧和李汶翰等21位男星担任表演嘉宾。可惜因节目组乱剪辑故意搞事情，郑爽老是被拎出来登上热搜，并且把一段非正片的视频放到网上，那个片段是郑爽与杨幂、卡斯柏、杜淳等人闲聊天，无意间郑爽顺嘴一说：“金晨喜欢的类型是谁，邓伦吗”？此视频立刻引发热议，有人觉得郑爽太八卦，乱cue邓伦、金晨2位昔日恋人太不礼貌。对此郑爽发文道歉，并斥责节目组的行为太过分，直言退出《追光吧哥哥》。可很多网友是因有郑爽的加盟才喜欢该节目，这下好了，如果没有郑爽，估计《追光吧哥哥》会少了许多乐趣。因为郑爽和金星都是那种说话耿直又有趣的艺人，彼此同框聊天太欢乐。现在郑爽选择退出，这让太多观众觉得可惜，不过粉丝支持郑爽的选择。因郑爽说话方式经常被吐槽，近日金星接受专访，她亲自为这位90后女星打抱不平，金星谈郑爽的性格，力夸这位90后花旦真敢说。在采访过程中，金星谈起与郑爽在《追光吧哥哥》的合作感受：“郑爽是一个直言不讳的东北姑娘，个性使然，没有那么多的装饰，有什么说什么，有时候会得罪一些人，大部分粉丝还是喜欢的”。郑爽以往说话都是这样，不像娱乐圈某些女星懂得如何掩饰自己，毕竟贵圈是被放在一个聚光灯下的圈子，学会谨言慎行、掩饰一些东西是人之常情。可贵圈也很难看到那种敢于直言不讳、表达真实想法的艺人。这次金星除了夸郑爽足够真实，其中还说了一句话被赞说到网友心坎，金星表示：“我像郑爽这个年龄也还没有像她这么敢说，有个性的人才会推动社会发展”。因为工作的特殊，作为艺人最擅长的事就是学会包装自己，尽可能注意一言一行，但也被磨得没有棱角和个性，都变得很圆滑太世道。而郑爽确实是那种不会藏着掖着的女明星，虽然有时也会说错话，但这样的性格在娱乐圈很难得。这次金星评价郑爽就非常客观，也赞赏她拥有直言不讳的性格。你对此怎么看？支持郑爽退出《追光吧哥哥》节目吗？,"金星谈郑爽性格,力挺90后花旦,一句话却说到网友心坎",https://new.qq.com/omn/20210104/20210104A06YU100.html
腾讯新闻,2021-01-04,"杨幂就曾经有一次被导演要求穿旗袍,杨幂自称自己太瘦了撑不起来旗袍之后,遭到了导演的强制要求,无奈换上旗袍的杨幂则以自己的水蛇腰惊艳全场。","杨幂自称太瘦撑不起旗袍,被导演强制要求后,“水蛇腰”惊艳全场",https://new.qq.com/omn/20210104/20210104A05IBK00.html
腾讯新闻,2021-01-04,娱乐圈有很多姐妹花，像最近热播剧《流金岁月》中的倪妮和刘诗诗，《爱情公寓》中的娄艺潇和李金铭，快本一姐谢娜和赵小刀。还有一对不得不提的是杨幂和迪丽热巴。当初，杨幂刚刚成立公司，签下了迪丽热巴等一众艺人。那时的杨幂身背巨额债务，为了能够快速还清债务，急需要一个人站出来挑起大梁，一起承担。可能是患难见真情，迪丽热巴迎难而上，在危难关头站了出来。杨幂也没有亏待她，嘉行刚成立那几年，杨幂为热巴砸了不少资源，去哪里都带着热巴，迪丽热巴凭借超高颜值和过硬的业务能力，在短短两年内就爆火成一线，成为最炙手可热的小花。热巴最火的时候，由她主演的电视剧一部接着一部，不停歇。随着《三生三世里桃花》的火热播出，热巴饰演的白凤九深受观众喜爱，也将热巴的事业推上了高潮。随后趁热打铁一举夺得了金鹰女神的称号。不过自从热巴获得金鹰女神之后，资源呈断崖式下跌，口碑也下降很多。因为“嘉兴大礼包”式的签合约的方式，（要想签热巴做女主，就必须带上嘉行其他艺人做女三女四，带新人），让热巴错失很多资源。热巴团队和公司开始有所不满，而当时很多其他公司向热巴递出橄榄枝，这让嘉行更加不满。对热巴的宣发也不上心，基本处于散养的状态。热巴和黄景瑜的电视剧《幸福，触手可及》扑的无声无息。黄景瑜那边还会宣传一些，热巴这边是一点动静都没有，都要热巴自己上场打call，然而在电视剧井喷的现在，电视剧不营销真的一点热度都没有。热巴和杨洋是《你是我的荣耀》也是毫无营销。也是从热巴资源下降开始，杨幂和热巴的互动变得少了很多，以前那么忙还会经常有合照，在微博互相宣传，但是这两年却没有这样的热搜了。今年的跨年晚会二人也是分别在不同的卫视跨年，也是没有互动。因此网络上关于二人闹掰了消息从未停过。近日还有的网友说迪丽热巴越来越杨幂话，难道二人是和好啦？该网友说热巴的眼神和嘴角说话超有杨幂的感觉，只看眉眼和笑容，完全就是杨幂呀！动图之下的热巴像是杨幂附体一样，更有网友夸张的说，连神态、声音都一样，甚至连脸都一样了，有杨幂说话那种高傲的味道。这个有点夸张了吧！都说好朋友在一起会越来越像，杨幂和迪丽热巴都是大美人，美女的气质、神态、说话方式都很相似啦！美人都是有相似之处的。热巴这么多年都没有离开嘉行，肯定也是舍不得杨幂吧！大家觉得迪丽热巴和杨幂越来越像了吗？关注猹猹，带你吃瓜，下期见！,"迪丽热巴逐渐“杨幂化”,神态语气一模一样,这是开始模仿杨幂了?",https://new.qq.com/omn/20210104/20210104A03G7V00.html
腾讯新闻,2021-01-04,继杨幂后，刘敏涛作为第二位来参加《追光吧！哥哥》的嘉宾，也可谓是吸引了不少观众的视线。从实力派演员到圈姐顶流，刘敏涛凭借一首《红色高跟鞋》外带翻白眼的表情包成功跨界，成为当下一代中年女演员中最具流量，人气最高的那一个，不得不说，哥哥节目邀请刘敏涛来参加，也是非常正确的决定了。如果说，去年夏天的《乘风破浪的姐姐》邀请的是一群非常厉害的姐姐，那这次《追光吧！哥哥》的厉害担当就当属金星与郑爽这两位常驻女嘉宾了，一个作为毒舌届的代表，一个凭借爽言爽语出圈，有这两位厉害姐姐的加盟，节目看点也是直线上升，再加上此次的刘敏涛，三个女人一台戏，想想就知道哥哥们有多可怜了。在刘敏涛正式到来之前，班主任金星跟人气助力官郑爽就坐在演播室开始盲猜这期节目嘉宾，金星显然已经知道了嘉宾就是刘敏涛，但还是说出一些关键信息让郑爽猜嘉宾是谁，金星表示对方是个神仙姐姐，并且戏特别好，郑爽非常开心的猜想是否会是刘涛跟孙俪要来了，喜悦的表情藏也藏不住。但随着金星给出最后一条提示后，郑爽前一秒开心激动的表情瞬间也变得淡漠下来。金星给出提示称，对方唱过《红色高跟鞋》，还有著名的翻白眼，这一听相信大多数人都知道金星说的就是刘敏涛了，郑爽自然也是瞬间心领神会，但表情管理却有一些失控，只是淡淡的“哦”了一声，并没有表现出对孙俪跟对刘涛那样的热情。随后，姗姗来迟的刘敏涛穿着一袭鲜艳的粉色连衣裙亮相，作为年龄最小的后辈，郑爽也是主动上前迎接并快速恢复表情管理，跟刘敏涛打招呼，说“你好”，然后还非常有礼貌的称呼刘敏涛为“老师”，刘敏涛则直接喊了郑爽的全名向她打了一声招呼，然后就很快落座与金星寒暄了起来。从郑爽对刘敏涛的称呼，以及对刘涛跟孙俪的称呼中，大家也可以明显的看到不同。对刘敏涛，郑爽称呼她为“老师”，对孙俪则称呼为“孙俪姐”，对刘涛则是“刘涛姐”，跟谁关系更好也是一目了然了。刘敏涛是演艺圈的大前辈，虽然最近凭借唱歌《红色高跟鞋》火出圈，但早在这首歌之前，刘敏涛就凭借出色的演技在《伪装者》、《琅琊榜》等剧中奠定了她老戏骨的地位，郑爽称呼她一声“老师”，也是显示出对前辈的尊重有礼貌，但同时这也代表着一众生疏、距离感。孙俪与刘涛就不一样了，孙俪与郑爽曾一起合作主演过电影《画壁》，当时孙俪就对郑爽这个小妹妹照顾有加，私下里郑爽也很喜欢欣赏孙俪邓超一家幸福生活的方式。刘涛虽然没有与郑爽拍过戏，但当时刘涛跟郑爽前男友张翰曾一起拍摄过综艺《花儿与少年》，当时张翰郑爽还没分手，节目过后，刘涛与张翰也成了关系非常好的姐弟，不管是节目上还是节目外，张翰都会经常跟刘涛谈论自己与郑爽的爱情，因此刘涛与郑爽也间接成了好友，郑爽写的书中，还有刘涛的亲笔书信，足以看得出来她们的私交有多好。如此来看，郑爽称呼她为“刘涛姐”也是倍感亲切了，如果刘涛或是孙俪能来参加节目，那郑爽自然也是开心的表情溢于言表。郑爽本就是一个慢热的人，在节目中一个人吐槽哥哥的时候，还显得很健谈，有什么说什么，但一旦有不熟悉的嘉宾跟她一起的时候，她就会变得很拘束，跟刘敏涛坐在一起点评哥哥们，也是尴尬满满，金星也是努力帮俩人活跃氛围打圆场。为了尽快让俩人相熟起来，金星也是主动cue话题，询问俩人在演艺圈拍戏这么久，有没有碰到过，但奈何俩人戏路完全不同，交集为零。俩人本就不太相熟，又有年龄代沟，对审美也有各自的看法，在看到个别表演的哥哥后，郑爽表示很喜欢，并且毫不吝啬地给出赞美之词后，一旁的刘敏涛却是一脸冷漠，不太能够有同感。当刘敏涛吐槽檀健次那组哥哥表演歌词重复太多的时候，郑爽则立刻反驳“他重复就是也可以”颜值即正义，谁让丁泽仁太帅了呢。看着刘敏涛一副翻白眼难以苟同的表情，网友也是哭笑不得了。,"郑爽盲猜节目嘉宾,得知是刘敏涛后表情淡漠,对其称呼与孙俪刘涛大...",https://new.qq.com/omn/20210104/20210104A04S8X00.html
腾讯新闻,2021-01-04,还有一个多月就到春节了，届时影视剧市场又将迎来一波热潮，电影方面期待值较高的当属王宝强刘昊然主演的《唐人街探案3》、贾玲沈腾主演的《你好，李焕英》、陈坤周迅主演的《侍神令》以及杨幂雷佳音主演的《刺杀小说家》。而在电视剧方面，赵本山的《乡村爱情13》则是观众期盼的年夜饭之一，毕竟该剧几乎每年都是在春节前后播出。1月3日，有网友在《乡村爱情》社交平台下留言，称《乡村爱情13》将于本月15日播出，虽然这个消息没有得到官方认可，但是分析一下本山传媒这段时间的相关动作，似乎该网友的这个判断有些依据。不久前，本山传媒为关婷娜搞了一个生日直播，随后又宣布在1月4日当天，毕畅也要与网友直播互动，而关婷娜饰演的杨晓燕、毕畅饰演的王小蒙，在《乡村爱情》女角色当中的地位很重要，或许这是在为该剧的开播进行宣传造势吧。最为关键的是，此前在《乡村爱情14》杀青时，演员于月仙曾经回复网友留言，称该剧将在春节期间播出。这样一算，如果《乡村爱情13》真的在本月15日播出的话，那么距离春节还剩4周的时间，该剧一共是40集，按照往年播出规律，一周上线6集的话，恰好在春节期间播完，与《乡村爱情14》完美接续。另外，赵本山的另一部电视剧《刘老根4》早已杀青，届时可能像去年那样，共同冲击春节电视剧市场，掀起乡村剧观看热潮。不知不觉，《乡村爱情》已经走到了第15个年头，记得在1月2日当天，电视剧《武林外传》开播15年引发了网友热议，如今同年开播的《乡村爱情》会不会也搞一个庆典呢，毕竟搞庆典可是象牙山村一贯的“传统”。值得一提的是，2006年开播的还有一部爆款剧《士兵突击》，当年这三部风格迥异的电视剧，可是让无数观众记忆犹新。随着剧情不断扩展，《乡村爱情》里的角色越来越多，象牙山村已经“人满为患”了，而且随着大个儿、宋晓峰等角色的崛起，曾经的主角王小蒙、谢永强等人彻底沦为了路人甲，而且据编剧杨景标透露，《乡村爱情13》里将安排宋晓峰和二丫玩直播，甚至还衍生出了一个综艺节目《乡村故事会》，届时作为导演付滃的夫人，二丫的戏份会不会像第12部里的小爽那样，直接戴上女主角的光环呢？作为地地道道的东北农村剧，《乡村爱情》里的角色名字非常具有地域特色，这一点从象牙山F4成员谢广坤、刘能、赵四、王老七就能看出来，有意思的是，他们老婆的名字更接地气，永强娘、刘英娘、玉田娘和小蒙娘，似乎很少有人知道她们叫什么名字。好在随着剧情的深入，《乡村爱情》里的各类角色都有了自己的名字，小李老师叫李银萍，王技术员叫王开山，王老七叫王忠诚，徐会计叫徐正超，刘大脑袋叫刘志，永强娘叫赵金凤，玉田娘叫王美兰，刘英娘叫李秀莲。那么问题来了，小蒙娘叫什么名字呢？这个说话慢悠悠的角色，虽然戏份不多，但也应该有个名字吧。另外，作为象牙山村大龄女青年，这么多年演下来，小李副总连一场像样的恋爱都没有，好不容易喜欢上了宋晓峰，奈何落花有意，流水无情。最为关键的是，你知道小李副总叫什么名字吗？,"网曝《乡村爱情13》15号开播,铁粉大考验,小蒙娘叫什么名字",https://new.qq.com/omn/20210104/20210104A057ON00.html
腾讯新闻,2021-01-04,"杨幂不觉得年龄是个问题,称50岁都不焦虑,是自信还是飘了? APP专享芳妮说娱乐1评2小时前 谢霆锋称:已经做好当爸爸的准备了! APP专享娱乐欢乐汇3评3小时前 正在...",《Beauty 小姐》蒋梦婕谈植发之痛 赞杨洋“长情”,http://new.qq.com/omn/ENT20190/20210104A05DIR00.html
